{
  "mode": "forcefield",
  "change": "Moving the engineering organization from quarterly releases to weekly continuous deployment",
  "drivingForces": [
    {
      "force": "Competitors are shipping customer-requested fixes in days while we take up to a quarter, costing us renewal conversations",
      "strength": 5
    },
    {
      "force": "The platform team has already built a CI/CD pipeline capable of automated canary deploys, removing most of the tooling gap",
      "strength": 4
    },
    {
      "force": "Engineering leadership has publicly committed to the change in the last two all-hands",
      "strength": 3
    }
  ],
  "restrainingForces": [
    {
      "force": "QA still relies on a 2-week manual regression pass for the billing module, which is incompatible with weekly releases",
      "strength": 5
    },
    {
      "force": "Several senior engineers are skeptical after a previous rushed-release incident caused a payment outage",
      "strength": 4
    },
    {
      "force": "Enterprise contracts with three large customers specify a fixed quarterly change-notification window",
      "strength": 3
    }
  ],
  "netAssessment": "Driving forces total 12 against restraining forces total 12 — the change is currently blocked at parity, not because the goal is wrong but because the billing QA bottleneck and contractual notice windows are unresolved dependencies, not attitude problems.",
  "recommendation": "Before increasing deploy frequency org-wide, automate the billing regression suite and renegotiate the quarterly notification clause with the three affected enterprise contracts — those two restraining forces are addressable and, once removed, the driving forces dominate."
}
